{
  "config": {
    "pageBorder": "1:1:1:1",
    "page": "A4",
    "pageAlignment": 1,
    "watermark": ""
  },
  "title": {
    "props": "Helvetica:18:100:center:0:0:1:0",
    "text": "Document with Image"
  },
  "table": [
    {
      "maxcolumns": 3,
      "rows": [
        {
          "row": [
            {
              "props": "Helvetica:12:100:left:1:1:1:1",
              "text": "Name"
            },
            {
              "props": "Helvetica:12:100:left:1:1:1:1",
              "text": "Age"
            },
            {
              "props": "Helvetica:12:100:left:1:1:1:1",
              "text": "Email"
            }
          ]
        },
        {
          "row": [
            {
              "props": "Helvetica:12:000:left:1:1:1:1",
              "text": "John Doe"
            },
            {
              "props": "Helvetica:12:000:left:1:1:1:1",
              "text": "30"
            },
            {
              "props": "Helvetica:12:000:left:1:1:1:1",
              "text": "john@example.com"
            }
          ]
        }
      ]
    }
  ],
  "image": [
    {
      "imagename": "sample-image.png",
      "imagedata": "",
      "width": 400,
      "height": 200
    }
  ],
  "footer": {
    "font": "Helvetica:10:001:center:0:0:0:0",
    "text": "Footer with Image Example"
  }
}