{
  "config": {
    "page": "A4",
    "pageAlignment": 1,
    "pageBorder": "0:0:0:0",
    "watermark": "CONFIDENTIAL"
  },
  "title": {
    "props": "font1:20:100:center:0:0:0:0",
    "text": "PROFESSIONAL SERVICES AGREEMENT"
  },
  "table": [
    {
      "maxcolumns": 1,
      "rows": [
        {
          "row": [
            { "props": "font1:10:000:left:0:0:0:0", "text": "This Professional Services Agreement (the \"Agreement\") is made and entered into as of October 25, 2023 (the \"Effective Date\"), by and between:" }
          ]
        }
      ]
    },
    {
      "maxcolumns": 2,
      "columnwidths": [1, 1],
      "bgcolor": "#F9F9F9",
      "rows": [
        {
          "row": [
            { "props": "font1:11:100:left:1:1:1:1", "text": "CLIENT INFORMATION" },
            { "props": "font1:11:100:left:1:1:1:1", "text": "PROVIDER INFORMATION" }
          ]
        },
        {
          "row": [
            { "props": "font1:10:000:left:1:1:0:0", "text": "Global Tech Solutions Ltd." },
            { "props": "font1:10:000:left:1:1:0:0", "text": "Apex Legal Consultants" }
          ]
        },
        {
          "row": [
            { "props": "font1:10:000:left:1:1:0:0", "text": "100 Innovation Drive" },
            { "props": "font1:10:000:left:1:1:0:0", "text": "500 Legal Plaza" }
          ]
        },
        {
          "row": [
            { "props": "font1:10:000:left:1:1:0:0", "text": "Silicon Valley, CA 94025" },
            { "props": "font1:10:000:left:1:1:0:0", "text": "New York, NY 10018" }
          ]
        },
        {
          "row": [
            { "props": "font1:10:000:left:1:1:1:1", "text": "Attn: Michael Chen, CTO" },
            { "props": "font1:10:000:left:1:1:1:1", "text": "Attn: Jessica Pearson, Partner" }
          ]
        }
      ]
    },
    {
      "maxcolumns": 1,
      "rows": [
        {
          "row": [
            { "props": "font1:12:100:left:0:0:0:0", "text": "1. SERVICES AND TERM" }
          ]
        }
      ]
    },
    {
      "maxcolumns": 2,
      "columnwidths": [1, 3],
      "rows": [
        {
          "row": [
            { "props": "font1:10:100:left:1:0:1:1", "text": "Project Name:" },
            { "props": "font1:10:000:left:0:1:1:1", "text": "Enterprise Software Licensing Review" }
          ]
        },
        {
          "row": [
            { "props": "font1:10:100:left:1:0:0:1", "text": "Scope of Services:" },
            { "props": "font1:10:000:left:0:1:0:1", "text": "Review of current software licenses, negotiation with vendors, and compliance audit." }
          ]
        },
        {
          "row": [
            { "props": "font1:10:100:left:1:0:0:1", "text": "Start Date:" },
            { "props": "font1:10:000:left:0:1:0:1", "text": "November 1, 2023" }
          ]
        },
        {
          "row": [
            { "props": "font1:10:100:left:1:0:0:1", "text": "End Date:" },
            { "props": "font1:10:000:left:0:1:0:1", "text": "January 31, 2024" }
          ]
        }
      ]
    },
    {
      "maxcolumns": 1,
      "rows": [
        {
          "row": [
            { "props": "font1:12:100:left:0:0:0:0", "text": "2. COMPENSATION" }
          ]
        }
      ]
    },
    {
      "maxcolumns": 2,
      "columnwidths": [1, 3],
      "rows": [
        {
          "row": [
            { "props": "font1:10:100:left:1:0:1:1", "text": "Total Fee:" },
            { "props": "font1:10:000:left:0:1:1:1", "text": "$15,000.00" }
          ]
        },
        {
          "row": [
            { "props": "font1:10:100:left:1:0:0:1", "text": "Payment Terms:" },
            { "props": "font1:10:000:left:0:1:0:1", "text": "50% upfront, 50% upon completion" }
          ]
        },
        {
          "row": [
            { "props": "font1:10:100:left:1:0:0:1", "text": "Late Penalty:" },
            { "props": "font1:10:000:left:0:1:0:1", "text": "1.5% per month on overdue amounts" }
          ]
        }
      ]
    },
    {
      "maxcolumns": 1,
      "rows": [
        {
          "row": [
            { "props": "font1:12:100:left:0:0:0:0", "text": "3. LEGAL PROVISIONS" }
          ]
        }
      ]
    },
    {
      "maxcolumns": 2,
      "columnwidths": [1, 3],
      "rows": [
        {
          "row": [
            { "props": "font1:10:100:left:1:0:1:1", "text": "Confidentiality:" },
            { "props": "font1:10:000:left:0:1:1:1", "text": "5 years from termination of agreement" }
          ]
        },
        {
          "row": [
            { "props": "font1:10:100:left:1:0:0:1", "text": "Governing Law:" },
            { "props": "font1:10:000:left:0:1:0:1", "text": "State of California" }
          ]
        },
        {
          "row": [
            { "props": "font1:10:100:left:1:0:0:1", "text": "Dispute Resolution:" },
            { "props": "font1:10:000:left:0:1:0:1", "text": "Arbitration in San Francisco, CA" }
          ]
        },
        {
          "row": [
            { "props": "font1:10:100:left:1:0:0:1", "text": "Termination Notice:" },
            { "props": "font1:10:000:left:0:1:0:1", "text": "30 days written notice" }
          ]
        }
      ]
    },
    {
      "maxcolumns": 1,
      "rows": [
        {
          "row": [
            { "props": "font1:12:100:left:0:0:0:0", "text": "IN WITNESS WHEREOF, the parties have executed this Agreement." }
          ]
        }
      ]
    },
    {
      "maxcolumns": 2,
      "columnwidths": [1, 1],
      "rows": [
        {
          "row": [
            { "props": "font1:10:100:left:0:0:0:0", "text": "CLIENT:" },
            { "props": "font1:10:100:left:0:0:0:0", "text": "PROVIDER:" }
          ]
        },
        {
          "row": [
            { "props": "font1:10:000:left:0:0:0:0", "text": "\n\n__________________________" },
            { "props": "font1:10:000:left:0:0:0:0", "text": "\n\n__________________________" }
          ]
        },
        {
          "row": [
            { "props": "font1:10:000:left:0:0:0:0", "text": "Name: Michael Chen" },
            { "props": "font1:10:000:left:0:0:0:0", "text": "Name: Jessica Pearson" }
          ]
        },
        {
          "row": [
            { "props": "font1:10:000:left:0:0:0:0", "text": "Title: Chief Technology Officer" },
            { "props": "font1:10:000:left:0:0:0:0", "text": "Title: Managing Partner" }
          ]
        },
        {
          "row": [
            { "props": "font1:10:000:left:0:0:0:0", "text": "Date: October 25, 2023" },
            { "props": "font1:10:000:left:0:0:0:0", "text": "Date: October 26, 2023" }
          ]
        }
      ]
    }
  ],
  "footer": {
    "font": "font1:8:000:center",
    "text": "Service Agreement - Page 1"
  }
}